{
  "schemaVersion": "lotus-platform.principal-denial-fixture.v2",
  "denialClass": "grant_store_unavailable",
  "principalKind": "user",
  "environmentPosture": "verified",
  "request": {
    "description": "A verified principal and a reachable route, with the grant store unavailable. Unavailable is a denial, not a pass.",
    "credential": {
      "present": true,
      "issuer": "https://identity.lotus.bank/example-idp",
      "audience": "lotus-gateway:composition",
      "keyId": "key-2026-09",
      "expired": false,
      "revoked": false,
      "subjectKind": "user",
      "verifierOutcome": "accept"
    },
    "tenantRef": "tenant:private-bank-sg",
    "requiredCapability": "manage.write",
    "grantStoreAvailable": false
  },
  "expected": {
    "revealsReasonDetail": false,
    "outcome": "denied",
    "status": 503,
    "failsAtStep": 3,
    "maxProtectedOperationCalls": 0
  }
}
